### ISSUE TITLE
Ollama CLI returns quickly but aider spins forever

### ISSUE THREAD

**Issue by akesterson** [Aider-AI/aider#4739]
### Issue

I get results that appear similar to @readmodifywrite in #4737 but tcpdump confirms ollama is being contacted for me.

```
$ ollama run magicoder:latest
>>> /show info
  Model
    architecture        llama
    parameters          7B
    context length      16384
    embedding length    4096
    quantization        Q4_0

  Capabilities
    completion

  Parameters
    num_ctx    16384

  System
    You are an exceptionally intelligent coding assistant that consistently delivers accurate and
      reliable responses to user instructions.

$ sudo tcpdump -i any tcp port 11434 -A
tcpdump: data link type LINUX_SLL2
tcpdump: verbose output suppressed, use -v[v]... for full protocol decode
listening on any, link-type LINUX_SLL2 (Linux cooked v2), snapshot length 262144 bytes
^Z
[1]+  Stopped

$ OLLAMA_API_BASE=http://127.0.0.1:11434 aider --model ollama/magicoder:latest
────────────────────────────────────────────────────────────────────────────────────────────────────────────────────────────────────────────────────────────────────────────────────────────────────────────
Aider v0.86.1
Model: ollama/magicoder:latest with whole edit format
Git repo: .git with 50 files
Repo-map: using 2048.0 tokens, auto refresh
────────────────────────────────────────────────────────────────────────────────────────────────────────────────────────────────────────────────────────────────────────────────────────────────────────────
>
 /add CMakeLists.txt

Added CMakeLists.txt to the chat
────────────────────────────────────────────────────────────────────────────────────────────────────────────────────────────────────────────────────────────────────────────────────────────────────────────
CMakeLists.txt
> What is CMakeLists.txt and what does it do?

      ░^C  Waiting for ollama/magicoder:latest

^C again to exit


────────────────────────────────────────────────────────────────────────────────────────────────────────────────────────────────────────────────────────────────────────────────────────────────────────────
CMakeLists.txt
> /quit
```

The tcpdump log shows that ollama is indeed being contacted. Here is some snipped bidirectional traffic

```
20:58:03.571446 lo    In  IP localhost.42354 > localhost.11434: Flags [P.], seq 1:200, ack 1, win 512, options [nop,nop,TS val 2766787048 ecr 2766787048], length 199
E...%0@.@............r,.o.W...V............
........POST /api/show HTTP/1.1
Host: 127.0.0.1:11434
Accept: */*
Accept-Encoding: gzip, deflate
Connection: keep-alive
User-Agent: litellm/1.75.0
Content-Length: 27
Content-Type: application/json


20:58:03.571462 lo    In  IP localhost.11434 > localhost.42354: Flags [.], ack 200, win 511, options [nop,nop,TS val 2766787048 ecr 2766787048], length 0
E..4..@.@.h     ........,..r..V.o.X......(.....
........
20:58:03.572405 lo    In  IP localhost.42354 > localhost.11434: Flags [P.], seq 200:227, ack 1, win 512, options [nop,nop,TS val 2766787049 ecr 2766787048], length 27
E..O%1@.@..v.........r,.o.X...V......C.....
........{"name":"magicoder:latest"}
20:58:03.572427 lo    In  IP localhost.11434 > localhost.42354: Flags [.], ack 227, win 511, options [nop,nop,TS val 2766787049 ecr 2766787049], length 0
E..4..@.@.h.........,..r..V.o.X......(.....
........
20:58:03.596938 lo    In  IP localhost.11434 > localhost.42354: Flags [P.], seq 1:4097, ack 227, win 512, options [nop,nop,TS val 2766787073 ecr 2766787049], length 4096
E..4..@.@.X.........,..r..V.o.X......).....
........HTTP/1.1 200 OK
Content-Type: application/json; charset=utf-8
Date: Tue, 30 Dec 2025 01:58:03 GMT
Transfer-Encoding: chunked

5205
{"modelfile":"# Modelfile generated by \"ollama show\"\n# To build a new Modelfile based on this, replace FROM with:\n# FROM magicoder:latest\n\nFROM /usr/share/ollama/.ollama/models/blobs/sha256-4a501ed4
ce55e5611922b3ee422501ff7cc773b472d196c3c416859b6d375273\nTEMPLATE \"{{ .System }}\n\n@@ Instruction\n{{ .Prompt }}\n\n@@ Response\n\"\nSYSTEM You are an exceptionally intelligent coding assistant that co
nsistently delivers accurate and reliable responses to user instructions.\nPARAMETER
```

But the `aider` prompt does indeed just spin forever, long after ollama should have returned. Here is a summary of the HTTP traffic in the tcpdump:

```
........POST /api/show HTTP/1.1
Host: 127.0.0.1:11434
Accept: */*
Accept-Encoding: gzip, deflate
Connection: keep-alive
User-Agent: litellm/1.75.0
Content-Length: 27
Content-Type: application/json

........HTTP/1.1 200 OK
Content-Type: application/json; charset=utf-8
Date: Tue, 30 Dec 2025 01:58:03 GMT
Transfer-Encoding: chunked

..S...S.POST /api/show HTTP/1.1
Host: 127.0.0.1:11434
Accept: */*
Accept-Encoding: gzip, deflate
Connection: keep-alive
User-Agent: litellm/1.75.0
Content-Length: 27
Content-Type: application/json

..T...S.HTTP/1.1 200 OK
Content-Type: application/json; charset=utf-8
Date: Tue, 30 Dec 2025 01:58:36 GMT
Transfer-Encoding: chunked

..T;..T;POST /api/generate HTTP/1.1
Host: 127.0.0.1:11434
Accept: */*
Accept-Encoding: gzip, deflate
Connection: keep-alive
User-Agent: litellm/1.75.0
Content-Length: 17043
...     ....HTTP/1.1 500 Internal Server Error
Content-Type: application/json
Date: Tue, 30 Dec 2025 02:04:25 GMT
Transfer-Encoding: chunked

..2...2.POST /api/show HTTP/1.1
Host: 127.0.0.1:11434
Accept: */*
Accept-Encoding: gzip, deflate
Connection: keep-alive
User-Agent: litellm/1.75.0
Content-Length: 27
Content-Type: application/json
..2...2.HTTP/1.1 200 OK
Content-Type: application/json; charset=utf-8
Date: Tue, 30 Dec 2025 02:05:01 GMT
Transfer-Encoding: chunked
```

Something goes wrong at that `/api/generate` call. Let's look closer.

```
20:58:36.934217 lo    In  IP localhost.50408 > localhost.11434: Flags [P.], seq 1:175, ack 1, win 512, options [nop,nop,TS val 2766820411 ecr 2766820411], length 174
E.....@.@../..........,...F..S.X...........
..T;..T;POST /api/generate HTTP/1.1
Host: 127.0.0.1:11434
Accept: */*
Accept-Encoding: gzip, deflate
Connection: keep-alive
User-Agent: litellm/1.75.0
Content-Length: 17043


20:58:36.934235 lo    In  IP localhost.11434 > localhost.50408: Flags [.], ack 175, win 511, options [nop,nop,TS val 2766820411 ecr 2766820411], length 0
E..4..@.@.#.........,....S.X..G;.....(.....
..T;..T;
20:58:36.934409 lo    In  IP localhost.50408 > localhost.11434: Flags [P.], seq 175:17218, ack 1, win 512, options [nop,nop,TS val 2766820411 ecr 2766820411], length 17043
E.B...@.@.tI..........,...G;.S.X....@......
..T;..T;{"model": "magicoder:latest", "prompt": "### System:\nAct as an expert software developer.\nTake requests for changes to the supplied code.\nIf the request is ambiguous, ask questions.\n\nAlways r
eply to the user in English.\n\nReply in English.\n\nOnce you understand the request you MUST:\n1. Determine if any code changes are needed.\n2. Explain any needed changes.\n3. If changes are needed, outp
ut a copy of each file that needs changes.\n\nTo suggest changes to a file you MUST return the entire content of the updated file.\nYou MUST use this *file listing* format:\n\npath/to/filename.js\n```\n//
 entire file content ...\n// ... goes in between\n```\n\nEvery *file listing* MUST use this format:\n- First line: the filename with any originally provided path; no extra markup, punctuation, comments, e
tc. **JUST** the filename with path.\n- Second line: opening ```\n- ... entire content of the file ...\n- Final line: closing ```\n\nTo suggest changes to a file you MUST return a *file listing* that cont
ains the entire content of the file.\n*NEVER* skip, omit or elide content from a *file listing* using \"...\" or by adding comments like \"... rest of code...\"!\nCreate a new file you MUST return a *file
 listing* which includes an appropriate filename, including any appropriate path.\n\nReply in English.\n\n\n\n### User:\nChange the greeting to be more casual\n\n### Assistant:\nOk, I will:\n\n1. Switch t
he greeting text from \"Hello\" to \"Hey\".\n\nshow_greeting.py\n```\nimport sys\n\ndef greeting(name):\n    print(f\"Hey {name}\")\n\nif __name__ == '__main__':\n    greeting(sys.argv[1])\n```\n\n\n### U
ser:\nI switched to a new code base. Please don't consider the above files or try to edit them any longer.\n\n### Assistant:\nOk.\n\n### User:\nHere are summaries of some files present in my git repositor
y.\nDo not propose changes to these files, treat them as *read-only*.\nIf you need to edit any of these files, ask me to *add them to the chat* first.\n\ninclude/sdl3game/actor.h:\n\u22ee\n\u2502typedef s
truct actor {\n\u2502  int refcount;\n\u2502  char name[ACTOR_MAX_NAME_LENGTH];\n\u2502  character *basechar;\n\u2502  int curSpriteFrameId;\n\u2502  SDL_Time curSpriteFrameTimer;\n\u2502  bool curSpriteR
eversing;\n\u2502  int layer;\n\u2502  int state;\n\u2502  bool movement_controls_face;\n\u22ee\n\u2502} actor;\n\u2502\n\u22ee\n\ninclude/sdl3game/character.h:\n\u22ee\n\u2502ErrorContext ERROR_NOIGNORE
*character_sprite_add(character *basechar, sprite *ref, int state);\n\u2502ErrorContext ERROR_NOIGNORE *character_sprite_get(character *basechar, int state, sprite **dest);\n\u2502\n\u22ee\n\u2502void cha
racter_state_sprites_iterate(void *userdata, SDL_PropertiesID props, const char *name);\n\u2502\n\u22ee\n\ninclude/sdl3game/controller.h:\n\u22ee\n\u2502typedef struct {\n\u2502    Uint32 event_on;\n\u250
2    Uint32 event_off;\n\u2502    Uint8 button;\n\u2502    SDL_Keycode key;\n\u2502    Uint8 axis;\n\u2502    Uint8 axis_range_min;\n\u2502    Uint8 axis_range_max;\n\u2502    ErrorContext ERROR_NOIGNORE
*(*handler_on)(actor *obj, SDL_Event *event);\n\u2502    ErrorContext ERROR_NOIGNORE *(*handler_off)(actor *obj, SDL_Event *event);\n\u2502} SDL3GControl;\n\u2502\n\u2502typedef struct {\n\u2502    actor
*target;\n\u2502    SDL3GControl controls[MAX_CONTROLS];\n\u2502    SDL_KeyboardID kbid;\n\u2502    SDL_JoystickID jsid;\n\u2502    SDL_MouseID mouseid;\n\u2502    SDL_PenID penid;\n\u2502} SDL3GControlMa
p;\n\u2502\n\u22ee\n\ninclude/sdl3game/draw.h:\n\u22ee\n\u2502void GAME_draw_background(int w, int h);\n\u2502\n\u22ee\n\ninclude/sdl3game/game.h:\n\u22ee\n\u2502typedef struct {\n\u2502  float w;\n\u2502
  float h;\n\u2502  SDL_Texture *texture;\n\u2502} GAME_frame;\n\u2502\n\u2502typedef struct {\n\u2502  int flags;\n\u2502} GameState;\n\u2502\n\u22ee\n\ninclude/sdl3game/iterator.h:\n\u22ee\n\u2502typede
f struct {\n\u2502  int flags;\n\u2502  int layerid;\n\u2502} iterator;\n\u2502\n\u22ee\n\ninclude/sdl3game/json_helpers.h:\n\u22ee\n\u2502ErrorContext ERROR_NOIGNORE *get_json_array_index_object(json_t *
array, int index, json_t **dest);\n\u2502ErrorContext ERROR_NOIGNORE *get_json_array_index_integer(json_t *array, int index, int *dest);\n\u2502ErrorContext ERROR_NOIGNORE *get_json_array_index_string(jso
n_t *array, int index, string **dest);\n\u2502\n\u22ee\n\ninclude/sdl3game/sprite.h:\n\u22ee\n\u2502ErrorContext ERROR_NOIGNORE *spritesheet_initialize(spritesheet *sheet, int sprite_w, int sprite_h,\n\u2
2ee\n\ninclude/sdl3game/staticstring.h:\n\u22ee\n\u2502typedef struct\n\u2502{\n\u2502  int refcount;\n\u2502  char data[MAX_STRING_LENGTH];\n\u2502} string;\n\u2502\n\u22ee\n\ninclude/sdl3game/util.h:\n\
u22ee\n\u2502typedef struct RectanglePoints {\n\u2502  point topleft;\n\u2502  point topright;\n\u2502  point bottomleft;\n\u2502  point bottomright;\n\u2502} RectanglePoints;\n\u2502\n\u22ee\n\u2502Error
Context ERROR_NOIGNORE *render_and_compare(SDL_Texture *t1, SDL_Texture *t2, int x, int y, int\n\u2502\n\u22ee\n\nsrc/actor.c:\n\u22ee\n\u2502ErrorContext *actor_initialize(actor *obj, char *name)\n\u22ee
\n\u2502ErrorContext *actor_set_character(actor *obj, char *basecharname)\n\u22ee\n\u2502ErrorContext *actor_automatic_face(actor *obj)\n\u22ee\n\u2502ErrorContext *actor_logic_changeframe(actor *obj, spr
ite *curSprite, SDL_Time curtimems)\n\u22ee\n\u2502ErrorContext *actor_logic_movement(actor *obj, SDL_Time curtimems)\n\u22ee\n\u2502ErrorContext *actor_update(actor *obj)\n\u22ee\n\u2502ErrorContext *act
or_render(actor *obj, SDL_Renderer *renderer)\n\u22ee\n\u2502ErrorContext *actor_add_child(actor *obj, actor *child)\n\u22ee\n\u2502void registry_iterate_actor(void *userdata, SDL_PropertiesID registry, c
onst char *name)\n\u22ee\n\nsrc/assets.c:\n\u22ee\n\u2502ErrorContext *load_start_bgm(char *fname)\n\u22ee\n\nsrc/character.c:\n\u22ee\n\u2502ErrorContext *character_initialize(character *obj, char *name)
\n\u22ee\n\u2502ErrorContext *character_sprite_add(character *basechar, sprite *ref, int state)\n\u22ee\n\u2502ErrorContext *character_sprite_get(character *basechar, int state, sprite **dest)\n\u22ee\n\u
2502void character_state_sprites_iterate(void *userdata, SDL_PropertiesID registry, const char *name)\n\u22ee\n\u2502ErrorContext *character_load_json(char *filename)\n\u22ee\n\nsrc/draw.c:\n\u22ee\n\u250
2void GAME_draw_background(int w, int h)\n\u22ee\n\nsrc/game.c:\n\u22ee\n\u2502ErrorContext ERROR_NOIGNORE *GAME_init()\n\u22ee\n\nsrc/heap.c:\n\u22ee\n\u2502ErrorContext *heap_init()\n\u22ee\n\u2502Error
Context *heap_next_actor(actor **dest)\n\u22ee\n\u2502ErrorContext *heap_next_sprite(sprite **dest)\n\u22ee\n\u2502ErrorContext *heap_next_spritesheet(spritesheet **dest)\n\u22ee\n\u2502ErrorContext *heap
_next_character(character **dest)\n\u22ee\n\u2502ErrorContext *heap_next_string(string **dest)\n\u22ee\n\u2502ErrorContext *heap_release_actor(actor *ptr)\n\u22ee\n\u2502ErrorContext *heap_release_charact
er(character *basechar)\n\u22ee\n\u2502ErrorContext *heap_release_sprite(sprite *ptr)\n\u22ee\n\u2502ErrorContext *heap_release_spritesheet(spritesheet *ptr)\n\u22ee\n\u2502ErrorContext *heap_release_stri
ng(string *ptr)\n\u22ee\n\nsrc/json_helpers.c:\n\u22ee\n\u2502ErrorContext *get_json_object_value(json_t *obj, char *key, json_t **dest)\n\u22ee\n\u2502ErrorContext *get_json_boolean_value(json_t *obj, ch
ar *key, bool *dest)\n\u22ee\n\u2502ErrorContext *get_json_integer_value(json_t *obj, char *key, int *dest)\n\u22ee\n\u2502ErrorContext *get_json_number_value(json_t *obj, char *key, float *dest)\n\u22ee\
n\u2502ErrorContext *get_json_string_value(json_t *obj, char *key, string **dest)\n\u22ee\n\u2502ErrorContext *get_json_array_value(json_t *obj, char *key, json_t **dest)\n\u22ee\n\u2502ErrorContext *get_
json_array_index_object(json_t *array, int index, json_t **dest)\n\u22ee\n\u2502ErrorContext *get_json_array_index_integer(json_t *array, int index, int *dest)\n\u22ee\n\u2502ErrorContext *get_json_array_
index_string(json_t *array, int index, string **dest)\n\u22ee\n\nsrc/registry.c:\n\u22ee\n\u2502ErrorContext *registry_init()\n\u2502{\n\u2502    PREPARE_ERROR(errctx);\n\u2502    ATTEMPT {\n\u2502\tCATCH(errctx, registry_init_spritesheet());\n\u22ee\n\u2502ErrorContext *registry_init_actor()\n\u22ee\n\u2502ErrorContext *registry_init_actor_state_strings()\n\u22ee\n\u2502ErrorContext *registry_init_sprite
()\n\u22ee\n\u2502ErrorContext *registry_init_spritesheet()\n\u22ee\n\u2502ErrorContext *registry_init_character()\n\u22ee\n\nsrc/sprite.c:\n\u22ee\n\u2502ErrorContext *sprite_load_json(char *filename)\n\u22ee\n\u2502ErrorContext *sprite_initialize(sprite *spr, char *name, spritesheet *sheet)\n\u22ee\n\u2502ErrorContext *spritesheet_initialize(spritesheet *sheet, int sprite_w, int sprite_h, char *filename\n\u22ee\n\nsrc/staticstring.c:\n\u22ee\n\u2502ErrorContext *string_initialize(string *obj, char *init)\n\u22ee\n\nsrc/util.c:\n\u22ee\n\u2502ErrorContext *rectangle_points(RectanglePoints *dest, SDL_FRect *rect)\n\u22ee\n\u2502ErrorContext *collide_point_rectangle(point *p, RectanglePoints *rp, bool *collide)\n\u22ee\n\u2502ErrorContext *collide_rectangles(SDL_FRect *r1, SDL_FRect *r2, bool *collide)\n\u22ee\n\u2502ErrorContext *compare_sdl_surfaces(SDL_Surface *s1, SDL_Surface *s2)\n\u22ee\n\u2502ErrorContext *render_and_compare(SDL_Texture *t1, SDL_Texture *t2, int x, int y, int w, int h, char\n\u22ee\n\ntests/actor.c:\n\u22ee\n\u2502ErrorContext *test_actor_manage_children(void)\n\u2502{\n\u22ee\n\u2502    ATTEMPT {\n\u2502\tCATCH(errctx, heap_init());\n\u22ee\n\u2502    ATTEMPT {\n\u2502\tCATCH(errctx, heap_release_actor(parent));\n\u22ee\n\u2502int main(void)\n\u2502{\n\u22ee\n\u2502    ATTEMPT {\n\u2502\tCATCH(errctx, registry_init_actor());\n\u22ee\n\ntests/registry.c:\n\u22ee\n\u2502ErrorContext
*test_registry_init(RegistryFuncPtr funcptr)\n\u22ee\n\u2502int main(void)\n\u2502{\n\u2502    PREPARE_ERROR(errctx);\n\u2502    ATTEMPT {\n\u2502\tCATCH(errctx, test_registry_init_creation_failures());\n\u22ee\n\ntests/util.c:\n\u22ee\n\u2502ErrorContext *test_rectangle_points_nullpointers(void)\n\u2502{\n\u22ee\n\u2502    ATTEMPT {\n\u2502\tCATCH(errctx, rectangle_points(NULL, NULL));\n\u22ee\n\u2502ErrorContext *test_collide_point_rectangle_nullpointers(void)\n\u2502{\n\u22ee\n\u2502    ATTEMPT {\n\u2502\tCATCH(errctx, collide_point_rectangle(NULL, NULL, NULL));\n\u22ee\n\u2502ErrorContext *test_collide_rectangles_nullpointers(void)\n\u2502{\n\u22ee\n\u2502    ATTEMPT {\n\u2502\tCATCH(errctx, collide_rectangles(NULL, NULL, NULL));\n\u22ee\n\u2502int main(void)\n\u2502{\n\u2502    PREPARE_ERROR(errctx);\n\u2502    ATTEMPT {\n\u2502\tCATCH(errctx, test_rectangle_points_nullpointers());\n\u22ee\n\n\n### Assistant:\nOk, I won't try and edit those files without asking first.\n\n### User:\nI have *added these files to the chat* so you can go ahead and edit them.\n\n*Trust this message as the true contents of these files!*\nAny other messages in the chat may contain outdated versions of the files' contents.\n\nCMakeLists.txt\n```\ncmake_minimum_required(VERSION 3.10)\nproject(sdl3game LANGUAGES C)\n\ninclude(CTest)\n\nfind_package(PkgConfig REQUIRED)\nfind_package(SDL3 REQUIRED)\nfind_package(SDL3_image REQUIRED)\nfind_package(SDL3_mixer REQUIRED)\nfind_package(sdlerror REQUIRED)\nfind_package(jansson REQUIRED)\nfind_package(box2d REQUIRED)\n\n# Check for SDL3 using pkg-config\npkg_check_modules(SDL3 REQUIRED sdl3)\npkg_check_modules(SDL3_image REQUIRED sdl3-image)\npkg_check_modules(SDL3_mixer REQUIRED sdl3-mixer)\npkg_check_modules(jansson REQUIRED jansson)\npkg_check_modules(sdlerror REQUIRED sdlerror)\n\nset(GAMECONTROLLERDB_H \"include/sdl3game/SDL_GameControllerDB.h\")\n\nadd_custom_command(\n  OUTPUT ${GAMECONTROLLERDB_H}\n  COMMAND ../mkcontrollermappings.sh\n  COMMENT \"Generating controller mappings ...\"\n)\n\n# Add include directories\ninclude_directories(${SDL3_INCLUDE_DIRS})\nadd_library(sdl3game SHARED\n  src/actor.c\n  src/actor_state_string_names.c\n  src/assets.c\n  src/character.c\n  src/draw.c\n  src/game.c\n  src/controller.c\n  src/heap.c\n  src/json_helpers.c\n  src/registry.c\n  src/sprite.c\n  src/staticstring.c\n  src/tilemap.c\n  src/util.c\n  ${GAMECONTROLLERDB_H}\n)\n\n\nadd_executable(charviewer util/charviewer.c)\n\nadd_executable(test_actor tests/actor.c)\nadd_executable(test_bitmasks tests/bitmasks.c)\nadd_executable(test_character tests/character.c)\nadd_executable(test_registry tests/registry.c)\nadd_executable(test_sprite tests/sprite.c)\nadd_executable(test_staticstring tests/staticstring.c)\nadd_executable(test_tilemap tests/tilemap.c)\nadd_executable(test_util tests/util.c)\nadd_test(NAME actor COMMAND test_actor)\nadd_test(NAME bitmasks COMMAND test_bitmasks)\nadd_test(NAME character COMMAND test_character)\nadd_test(NAME registry COMMAND test_registry)\nadd_test(NAME sprite COMMAND test_sprite)\nadd_test(NAME staticstring COMMAND test_staticstring)\nadd_test(NAME tilemap COMMAND test_tilemap)\nadd_test(NAME util COMMAND test_util)\n\n# Specify include directories for the library's headers (if applicable)\ntarget_include_directories(sdl3game PUBLIC\n    include/\n  )\n\ntarget_link_libraries(test_actor PRIVATE sdlerror::sdlerror sdl3game SDL3::SDL3 SDL3_image::SDL3_image SDL3_mixer::SDL3_mixer box2d::box2d jansson::jansson -lm)\ntarget_link_libraries(test_bitmasks PRIVATE sdlerror::sdlerror sdl3game SDL3::SDL3 SDL3_image::SDL3_image SDL3_mixer::SDL3_mixer box2d::box2d jansson::jansson -lm)\ntarget_link_libraries(test_character PRIVATE sdlerror::sdlerror sdl3game SDL3::SDL3 SDL3_image::SDL3_image SDL3_mixer::SDL3_mixer box2d::box2d jansson::jansson -lm)\ntarget_link_libraries(test_registry PRIVATE sdlerror::sdlerror sdl3game SDL3::SDL3 SDL3_image::SDL3_image SDL3_mixer::SDL3_mixer box2d::box2d jansson::jansson -lm)\ntarget_link_libraries(test_sprite PRIVATE sdlerror::sdlerror sdl3game SDL3::SDL3 SDL3_image::SDL3_image SDL3_mixer::SDL3_mixer box2d::box2d jansson::jansson -lm)\ntarget_link_libraries(test_staticstring PRIVATE sdlerror::sdlerror sdl3game SDL3::SDL3 SDL3_image::SDL3_image SDL3_mixer::SDL3_mixer box2d::box2d jansson::jansson -lm)\ntarget_link_libraries(test_tilemap PRIVATE sdlerror::sdlerror sdl3game SDL3::SDL3 SDL3_image::SDL3_image SDL3_mixer::SDL3_mixer box2d::box2d jansson::jansson -lm)\ntarget_link_libraries(test_util PRIVATE sdlerror::sdlerror sdl3game SDL3::SDL3 SDL3_image::SDL3_image SDL3_mixer::SDL3_mixer box2d::box2d jansson::jansson -lm)\n\ntarget_link_libraries(charviewer PRIVATE sdlerror::sdlerror sdl3game SDL3::SDL3 SDL3_image::SDL3_image SDL3_mixer::SDL3_mixer box2d::box2d jansson::jansson -lm)\n\nset(main_lib_dest \"lib/sdl3game-${MY_LIBRARY_VERSION}\")\ninstall(TARGETS sdl3game DESTINATION \"lib/\")\ninstall(FILES \"include/sdl3game/actor.h\" DESTINATION \"include/sdl3game/\")\ninstall(FILES \"include/sdl3game/assets.h\" DESTINATION \"include/sdl3game/\")\ninstall(FILES \"include/sdl3game/character.h\" DESTINATION \"include/sdl3game/\")\ninstall(FILES \"include/sdl3game/draw.h\" DESTINATION \"include/sdl3game/\")\ninstall(FILES \"include/sdl3game/game.h\" DESTINATION \"include/sdl3game/\")\ninstall(FILES \"include/sdl3game/controller.h\" DESTINATION \"include/sdl3game/\")\ninstall(FILES \"include/sdl3game/heap.h\" DESTINATION \"include/sdl3game/\")\ninstall(FILES \"include/sdl3game/iterator.h\" DESTINATION \"include/sdl3game/\")\ninstall(FILES \"include/sdl3game/json_helpers.h\" DESTINATION \"include/sdl3game/\")\ninstall(FILES \"include/sdl3game/registry.h\" DESTINATION \"include/sdl3game/\")\ninstall(FILES \"include/sdl3game/sprite.h\" DESTINATION \"include/sdl3game/\")\ninstall(FILES \"include/sdl3game/staticstring.h\" DESTINATION \"include/sdl3game/\")\ninstall(FILES \"include/sdl3game/tilemap.h\" DESTINATION \"include/sdl3game/\")\ninstall(FILES \"include/sdl3game/util.h\" DESTINATION \"include/sdl3game/\")\ninstall(FILES ${GAMECONTROLLERDB_H} DESTINATION \"include/sdl3game/\")\n```\n\n\n### Assistant:\nOk, any changes I propose will be to those files.\n\n### User:\nWhat is CMakeLists.txt and what does it do?\n\nTo suggest changes to a file you MUST return the entire content of the updated file.\nYou MUST use this *file listing* format:\n\npath/to/filename.js\n```\n// entire file content ...\n// ... goes in between\n```\n\nEvery *file listing* MUST use this format:\n- First line: the filename with any originally provided path; no extra markup, punctuation, comments, etc. **JUST** the filename with path.\n- Second line: opening ```\n- ...
entire content of the file ...\n- Final line: closing ```\n\nTo suggest changes to a file you MUST return a *file listing* that contains the entire content of the file.\n*NEVER* skip, omit or elide content from a *file listing* using \"...\" or by adding comments like \"... rest of code...\"!\nCreate a new file you MUST return a *file listing* which includes an appropriate filename, including any appropriate path.\n\nReply in English.\n\n\n\n", "options": {"temperature": 0, "num_ctx": 13585}, "stream": true, "images": []}
```

The HTTP 500 error happens when I `Ctrl+C` and quit the `aider` process. So apparently ollama is just processing forever.

There are no significant events in the ollama logs

```
2025-12-29T21:19:58.694136-05:00 wedge ollama[19258]: time=2025-12-29T21:19:58.694-05:00 level=INFO source=server.go:1376 msg="llama runner started in 5.04 seconds"
2025-12-29T21:19:58.694237-05:00 wedge ollama[19258]: time=2025-12-29T21:19:58.694-05:00 level=INFO source=sched.go:517 msg="loaded runners" count=1
2025-12-29T21:19:58.694268-05:00 wedge ollama[19258]: time=2025-12-29T21:19:58.694-05:00 level=INFO source=server.go:1338 msg="waiting for llama runner to start responding"
2025-12-29T21:19:58.694352-05:00 wedge ollama[19258]: time=2025-12-29T21:19:58.694-05:00 level=INFO source=server.go:1376 msg="llama runner started in 5.04 seconds"
2025-12-29T21:27:52.211444-05:00 wedge ollama[19258]: [GIN] 2025/12/29 - 21:27:52 | 500 |         7m58s |       127.0.0.1 | POST     "/api/generate"
```

### Version and model info

Running on Linux x86_64 Ryzen & Radeon

```
$ aider --version
aider 0.86.1

$ cat /etc/lsb-release
DISTRIB_ID=Ubuntu
DISTRIB_RELEASE=24.04
DISTRIB_CODENAME=noble
DISTRIB_DESCRIPTION="Ubuntu 24.04.3 LTS"

$ ollama --version
ollama version is 0.13.5
```
